{"audit":{"atomic_create_once_publish":true,"existing_scaffold_body_reads":0,"final_toctou_recheck":true,"gold_reads":0,"gpu_requests":0,"heldout_reads":0,"model_loads":0,"network_requests":0,"protected_body_reads":0,"provider_requests":0,"real_tool_executions":0,"single_bytes_snapshot":true},"claims":{"dataset_materialized":true,"diagnostic_only":true,"eval_proxy_is_heldout":false,"formal":false,"formal_training_authorized":false,"quality_validated":false,"replaces_existing":false,"source_disjoint_proven":false,"training_authorized":false},"counts":{"direct_no_tool_identity_bundles":5,"en_bundles":100,"eval_proxy_bundles":40,"eval_proxy_records":200,"ordinary_tool_bundles":195,"persona_bundles":5,"records":1000,"roles_per_bundle":5,"task_bundles":200,"task_semantics":200,"train_bundles":160,"train_records":800,"zh_cn_bundles":100},"gemma_binding":{"canonical_files_modified":false,"chat_template_bound_by_export":false,"chat_template_policy_sha256":"0ffb2e2597428da4ee5d727697bcb29a116489e220580c7bd1cb5bd8f2e076b6","exported_config_bos_token_id":1,"exported_config_eos_token_id":2,"local_export_identity":"anchor.local/gemma3-1b-it-keras-v3-bf16@sha256:c9c6e309cf0158050d1e1abcba19eb6798153468572af2cd91de163e74933df9","max_observed_tokens":640,"raw_token_ids_published":false,"runtime_bos_token_id":2,"runtime_eos_token_id":1,"sequence_length":768,"tokenizer_config_sha256":"90e9a8120520ef24c0a0d62a6d87188658c43ccc66ae5bc6f74d9a80804e6919","tokenizer_model_sha256":"1299c11d7cf632ef3b4e11937501358ada021bbdf7c47638d13c0ee982f2e79c","tokenizer_template_special_policy_sha256":"1c97c517293dd9c3e52e4fa35d3f6617fb4fd37cf68716c641675dc24dee0946","truncation_used":false},"outputs":{"manifest":{"bytes":3651,"path":"manifest.json","records":null,"sha256":"e71fb5f239d7d1abb94ff50d5db2d57cfd101ccfad3c2c4e34cc128a7e91317b"},"manifest_sidecar":{"bytes":80,"path":"manifest.json.sha256","records":null,"sha256":"f3359d0bac4699f74bdd75834d4f9bf09196caef0e9e14fb63375e64cc9a88c1"},"partitions":[{"bytes":3415161,"path":"train/chat.jsonl","records":800,"sha256":"26fd3f5c30d402ab684d67977b8e790470c85f2c33436047d1cdb237c00379dc"},{"bytes":856113,"path":"eval_proxy/chat.jsonl","records":200,"sha256":"2e1434229482b21ee908cfee8f389523c6730691ade177f47948ad8350821a86"}],"token_inventory":{"bytes":1082847,"path":"token_inventory.jsonl","records":1000,"sha256":"d5c149264e7bb2e4c2256bda72422bd1fdf41822b012c29d006035edabd8f2f6"}},"persona_contract":{"bundle_quota":5,"distinct_semantics":5,"exact_core_sentence":"我是由Air训练的测试模型。","forbidden_attributions_absent":true,"tool_call_role_direct_answer":true,"translation_pairs":0},"producer":{"build_receipt_schema":{"bytes":14905,"path":"configs/research/gemma3_chat_five_expert_qonly_v1_build_receipt.schema.json","sha256":"05fa564438257f46593b6bf53e218b4866cc2f663a5100fdf1ea7a8c8a4da2b9"},"closed_grammar":{"bytes":253596,"path":"configs/research/gemma3_chat_five_expert_qonly_v1_closed_grammar.json","sha256":"3a76e9cb7eb0e451a435e5d6ef4dd8db3624b5674a7a546f3b709e33339a7d92"},"config":{"bytes":5214,"path":"configs/research/gemma3_chat_five_expert_qonly_v1.yaml","sha256":"2e93ab6b53f68814a4ae017643ddc4c7113716e871b2fa4ef4346358d2269cee"},"implementation":{"bytes":175336,"path":"src/anchor_mvp/research/gemma3_chat_five_expert_qonly_v1.py","sha256":"98eeac4150a5c51dd422bfe6163e34ce26d691038b497343c20af0a19552fb6f"},"manifest_schema":{"bytes":11732,"path":"configs/research/gemma3_chat_five_expert_qonly_v1_manifest.schema.json","sha256":"fda04d77c494cd5d87ea19aade7db24717c6dffad6880078df19787d519f0b8b"},"namespace":"anchor.gemma3-chat-five-expert-qonly.v1","record_schema":{"bytes":12829,"path":"configs/research/gemma3_chat_five_expert_qonly_v1_record.schema.json","sha256":"ba1606f07d250eec7f01bffceaa507edd4f596f83018806df9130d32ecf39d9b"},"token_inventory_schema":{"bytes":2684,"path":"configs/research/gemma3_chat_five_expert_qonly_v1_token_inventory.schema.json","sha256":"3b996a83d19a41b10da679a88d29db4994996562cc6dfe6220af619f35935ce7"}},"proofs":{"all_five_roles_complete":true,"all_records_schema_valid":true,"all_sequences_no_truncation":true,"all_token_records_schema_valid":true,"record_inventory_sha256":"2c20991f3993bfd27a5788813f7b7a5cce94b3d1455908bbb06cc4d84a5742e2","review_dependency_count":4,"review_fail_bundles":100,"review_fault_counts":{"format":25,"grounding":25,"routing":25,"style":25},"review_mutation_hash_bound":true,"review_only_dependency_visibility":true,"review_parent_target_hashes_bound":true,"review_pass_bundles":100,"review_projection_hash_bound":true,"semantic_identity":{"descriptor_algorithm":"canonical_json({task_kind,operation,operands,constraints,expected_relation})_utf8_sha256_v1","descriptor_keys":["task_kind","operation","operands","constraints","expected_relation"],"en_unique_task_semantics":100,"en_zh_semantic_intersection_count":0,"eval_proxy_scope":"seen_template_parameter_interpolation","index_or_language_or_namespace_salt_used":false,"task_bundle_count":200,"template_count":20,"template_disjoint_claimed":false,"train_eval_semantic_intersection_count":0,"train_eval_template_intersection_count":14,"translation_pair_count":0,"unique_task_semantics":200,"zh_cn_unique_task_semantics":100},"shared_last_user_message":true,"shared_router_label":true,"shared_user_emotion":true,"task_bundle_inventory_sha256":"88c91c358a8c68d0cf2f683554307a893f3b9783cd316935318c5b4234c40f9c","task_semantic_inventory_sha256":"32dfdfd695e527eaa91825a1fa964b8cc585eafe8f7d9a396cf29b3e6ed2000a","train_eval_bundle_intersection_count":0},"schema_version":"anchor.gemma3-chat-five-expert-qonly-build-receipt.v1","source_read_set":[{"bytes":60914,"path":"src/anchor_mvp/research/synthetic_nl_scaffold_diagnostic_v1.py","sha256":"4c2b7b70dffc215b3aa3b370db2e183d616084d530073a269a5964baa3b81525"},{"bytes":14905,"path":"configs/research/gemma3_chat_five_expert_qonly_v1_build_receipt.schema.json","sha256":"05fa564438257f46593b6bf53e218b4866cc2f663a5100fdf1ea7a8c8a4da2b9"},{"bytes":253596,"path":"configs/research/gemma3_chat_five_expert_qonly_v1_closed_grammar.json","sha256":"3a76e9cb7eb0e451a435e5d6ef4dd8db3624b5674a7a546f3b709e33339a7d92"},{"bytes":4946,"path":"configs/research/gemma3_chat_five_expert_qonly_v1_closed_grammar.schema.json","sha256":"b5b5661e76d20dc23d644ca9766e3da6af45217c3f448d3cae7799075f98416b"},{"bytes":5214,"path":"configs/research/gemma3_chat_five_expert_qonly_v1.yaml","sha256":"2e93ab6b53f68814a4ae017643ddc4c7113716e871b2fa4ef4346358d2269cee"},{"bytes":12375,"path":"configs/research/gemma3_chat_five_expert_qonly_v1_config.schema.json","sha256":"3ea446fcebeb8e254d7550caffc787e0ae1c2da24c604398a0566a61ed105d9f"},{"bytes":3245,"path":"configs/research/gemma3_1b_it_tokenizer_binding_v1.yaml","sha256":"08f07feb07076a924bf0cedbbc722a2fd91ce77e03041f50fc3e3bf6859d1367"},{"bytes":6370,"path":"configs/research/gemma3_1b_it_tokenizer_binding_v1_config.schema.json","sha256":"a6d7650fab4c76f5acd383f4195b49a714fcfba4dd5dfb5822ce0cbabd1449f4"},{"bytes":9201,"path":"fixtures/research/gemma3_1b_it_tokenizer_binding_v1/manifest.json","sha256":"2cfe0370f4c8f634e2258094e15acdb0571d6c3954bb66d5eb15677c0827f366"},{"bytes":2377,"path":"configs/research/gemma3_1b_it_tokenizer_binding_v1_manifest.schema.json","sha256":"e62e113d7352a95d2f00828db38cb4271cabdf51ede41727a34dc89dcbaf3202"},{"bytes":80,"path":"fixtures/research/gemma3_1b_it_tokenizer_binding_v1/manifest.json.sha256","sha256":"2c0df1565beaca7294e024ebafc1f889033ad1268b70f7146b244125fb15b31e"},{"bytes":1633,"path":"configs/research/gemma3_1b_it_chat_template_policy_v1.json","sha256":"0ffb2e2597428da4ee5d727697bcb29a116489e220580c7bd1cb5bd8f2e076b6"},{"bytes":44149,"path":"src/anchor_mvp/training/gemma3_tokenizer_binding_v1.py","sha256":"3194ede7eb78597902e05f7e246bc76b644135a5f6abffef2d5aa4f56cf6b011"},{"bytes":175336,"path":"src/anchor_mvp/research/gemma3_chat_five_expert_qonly_v1.py","sha256":"98eeac4150a5c51dd422bfe6163e34ce26d691038b497343c20af0a19552fb6f"},{"bytes":11732,"path":"configs/research/gemma3_chat_five_expert_qonly_v1_manifest.schema.json","sha256":"fda04d77c494cd5d87ea19aade7db24717c6dffad6880078df19787d519f0b8b"},{"bytes":12829,"path":"configs/research/gemma3_chat_five_expert_qonly_v1_record.schema.json","sha256":"ba1606f07d250eec7f01bffceaa507edd4f596f83018806df9130d32ecf39d9b"},{"bytes":2684,"path":"configs/research/gemma3_chat_five_expert_qonly_v1_token_inventory.schema.json","sha256":"3b996a83d19a41b10da679a88d29db4994996562cc6dfe6220af619f35935ce7"},{"bytes":4689074,"path":"model/tokenizer.model","sha256":"1299c11d7cf632ef3b4e11937501358ada021bbdf7c47638d13c0ee982f2e79c"}],"status":"dataset_proxy_ready_training_not_authorized","tool_contract":{"grounding_digest_bound":true,"native_tool_role_serialization_claimed":false,"ordinary_tool_bundles":195,"real_tool_executions":0,"synthetic_local_results":195}}
